{
  "anchor_id": "anchor-0123456789abcdef",
  "chunk_id": "chunk-0123456789abcdef",
  "section_id": "section-0123456789abcdef",
  "doc_id": "doc-workspace-helpcenter-001",
  "source_id": "doc:workspace:000000000001",
  "source_fingerprint": "aaaaaaaaaaaaaaaaaaaaaaaaaaaaaaaaaaaaaaaaaaaaaaaaaaaaaaaaaaaaaaaa",
  "asset_type": "html",
  "anchor_type": "section",
  "source_url_or_path": "s3://omni-raw-documents/workspace/helpcenter/getting-started.html",
  "section_path": "Getting Started",
  "doc_version": "manifest-workspace-helpcenter-20260331-001",
  "page_no": null,
  "bbox": null,
  "bbox_missing_reason": null,
  "parser_backend": "fallback",
  "parser_capability": {
    "preserves_page": false,
    "preserves_bbox": false,
    "preserves_table": false,
    "fallback_used": true,
    "warnings": ["fallback_parser_used"]
  },
  "data_release_id": "week07-dev-local",
  "created_at": "2026-04-24T00:00:00+00:00"
}
